{
  "document_sha256": "a1e631f48b595f2a436b348dbd49e0aea6f7391a48440ccd64b440a204c9ecbf",
  "fields": [
    {
      "confidence": 0.99,
      "confidence_kind": "invented_not_calibrated",
      "document_sha256": "a1e631f48b595f2a436b348dbd49e0aea6f7391a48440ccd64b440a204c9ecbf",
      "evidence": {
        "block_id": "line-1",
        "bounding_box": {
          "Height": 0.022727272727272728,
          "Left": 0.08169934640522876,
          "Top": 0.09848484848484848,
          "Width": 0.6535947712418301
        }
      },
      "method": "synthetic_fixture_v1",
      "name": "invoice_number",
      "page": 1,
      "value": "SYN-2026-001"
    },
    {
      "confidence": 0.99,
      "confidence_kind": "invented_not_calibrated",
      "document_sha256": "a1e631f48b595f2a436b348dbd49e0aea6f7391a48440ccd64b440a204c9ecbf",
      "evidence": {
        "block_id": "line-2",
        "bounding_box": {
          "Height": 0.022727272727272728,
          "Left": 0.08169934640522876,
          "Top": 0.12878787878787878,
          "Width": 0.6535947712418301
        }
      },
      "method": "synthetic_fixture_v1",
      "name": "vendor",
      "page": 1,
      "value": "Juniper Example Supplies"
    },
    {
      "confidence": 0.99,
      "confidence_kind": "invented_not_calibrated",
      "document_sha256": "a1e631f48b595f2a436b348dbd49e0aea6f7391a48440ccd64b440a204c9ecbf",
      "evidence": {
        "block_id": "line-3",
        "bounding_box": {
          "Height": 0.022727272727272728,
          "Left": 0.08169934640522876,
          "Top": 0.1590909090909091,
          "Width": 0.6535947712418301
        }
      },
      "method": "synthetic_fixture_v1",
      "name": "date",
      "page": 1,
      "value": "2026-10-01"
    },
    {
      "confidence": 0.99,
      "confidence_kind": "invented_not_calibrated",
      "document_sha256": "a1e631f48b595f2a436b348dbd49e0aea6f7391a48440ccd64b440a204c9ecbf",
      "evidence": {
        "block_id": "line-4",
        "bounding_box": {
          "Height": 0.022727272727272728,
          "Left": 0.08169934640522876,
          "Top": 0.1893939393939394,
          "Width": 0.6535947712418301
        }
      },
      "method": "synthetic_fixture_v1",
      "name": "currency",
      "page": 1,
      "value": "USD"
    },
    {
      "confidence": 0.99,
      "confidence_kind": "invented_not_calibrated",
      "document_sha256": "a1e631f48b595f2a436b348dbd49e0aea6f7391a48440ccd64b440a204c9ecbf",
      "evidence": {
        "block_id": "line-5",
        "bounding_box": {
          "Height": 0.022727272727272728,
          "Left": 0.08169934640522876,
          "Top": 0.2196969696969697,
          "Width": 0.6535947712418301
        }
      },
      "method": "synthetic_fixture_v1",
      "name": "total",
      "page": 1,
      "value": "125.00"
    }
  ],
  "schema_version": "1.0",
  "source_kind": "synthetic"
}
